{
  "$schema": "../../../schemas/iteration_evidence_v2.schema.json",
  "iteration_number": 14,
  "recorded_at": "2026-02-03T03:19:19Z",
  "commit_sha": "abc1234567890",
  "runner": {
    "os": "darwin-24.6.0",
    "python": "3.13.2",
    "arch": "x86_64"
  },
  "source": {
    "source_path": "docs/acceptance/iteration_14_regression.md"
  },
  "commands": [
    {
      "name": "ci",
      "command": "make ci",
      "result": "PASS"
    }
  ],
  "overall_result": "PASS",
  "sensitive_data_declaration": true,
  "links": {
    "regression_doc_url": "docs/acceptance/iteration_14_regression.md"
  }
}
