{
  "$schema": "../../../schemas/iteration_evidence_v2.schema.json",
  "iteration_number": 22,
  "recorded_at": "2026-02-03T09:11:54Z",
  "commit_sha": "80a747b313a93459df5379b706de36c6a854eb8b",
  "runner": {
    "os": "darwin-24.6.0",
    "python": "3.13.2",
    "arch": "x86_64"
  },
  "source": {
    "source_path": "docs/acceptance/iteration_22_regression.md"
  },
  "links": {
    "regression_doc_url": "docs/acceptance/iteration_22_regression.md"
  },
  "commands": [
    {
      "name": "ci",
      "command": "make ci",
      "result": "PASS",
      "exit_code": 0
    }
  ],
  "overall_result": "PASS",
  "sensitive_data_declaration": true
}
