{
  "$schema": "../../../schemas/iteration_evidence_v2.schema.json",
  "iteration_number": 21,
  "recorded_at": "2026-02-23T20:16:54Z",
  "commit_sha": "abc1234567890abc1234567890abc1234567890",
  "runner": {
    "os": "windows-11",
    "python": "3.13.6",
    "arch": "x86_64"
  },
  "source": {
    "source_path": "docs/acceptance/iteration_21_regression.md"
  },
  "commands": [
    {
      "name": "ci",
      "command": "make ci",
      "result": "PASS",
      "exit_code": 0
    }
  ],
  "overall_result": "PASS",
  "sensitive_data_declaration": true
}