{
  "$schema": "../../../schemas/iteration_evidence_v2.schema.json",
  "iteration_number": 8,
  "recorded_at": "2026-02-23T20:16:55Z",
  "commit_sha": "abc1234567890",
  "runner": {
    "os": "windows-11",
    "python": "3.13.6",
    "arch": "x86_64"
  },
  "source": {
    "source_path": "docs/acceptance/iteration_8_regression.md"
  },
  "commands": [
    {
      "name": "test",
      "command": "make test",
      "result": "PASS",
      "summary": "Test passed"
    }
  ],
  "overall_result": "PASS",
  "sensitive_data_declaration": true,
  "links": {
    "regression_doc_url": "docs/acceptance/iteration_8_regression.md"
  },
  "notes": "[REDACTED]",
  "redaction_applied": true,
  "redaction_summary": "检测并脱敏 1 处敏感信息",
  "redaction_rules": [
    "sensitive-value"
  ]
}