{
  "$schema": "../../../schemas/iteration_evidence_v2.schema.json",
  "iteration_number": 13,
  "recorded_at": "2026-02-23T20:16:55Z",
  "commit_sha": "abc1234def5678901234567890abcdef12345678",
  "runner": {
    "os": "windows-11",
    "python": "3.13.6",
    "arch": "x86_64",
    "runner_label": "windows-latest"
  },
  "source": {
    "source_path": "docs/acceptance/iteration_13_regression.md"
  },
  "commands": [
    {
      "name": "lint",
      "command": "make lint",
      "result": "PASS",
      "summary": "ruff check passed",
      "duration_seconds": 5.2,
      "exit_code": 0
    },
    {
      "name": "typecheck",
      "command": "make typecheck",
      "result": "PASS",
      "summary": "mypy passed",
      "duration_seconds": 12.8,
      "exit_code": 0
    },
    {
      "name": "test",
      "command": "make test",
      "result": "PASS",
      "summary": "142 passed, 0 failed",
      "duration_seconds": 45.3,
      "exit_code": 0
    }
  ],
  "overall_result": "PASS",
  "sensitive_data_declaration": true,
  "links": {
    "ci_run_url": "https://github.com/org/repo/actions/runs/12345",
    "regression_doc_url": "docs/acceptance/iteration_13_regression.md"
  },
  "notes": "所有门禁通过，验收完成。"
}